topic cluster	importances
silly AND surprise	0.0
year AND ending AND treasurygov AND penalty AND debt AND clinton AND federal AND sept AND suck AND marriage AND numbskullnbesides AND pal AND added AND every AND told	0.0
favor AND criticized AND realisticly AND people AND prime AND fck AND upsurd AND luck AND rabbits AND im AND sox AND talking AND endure AND comments AND hitting AND saying AND problem AND perform AND try AND fans AND main AND team AND sht AND pulling AND home AND certainly AND absolutely AND rsn AND stay AND house AND criticize AND example AND red AND ridiculous AND constantly AND shut AND club AND foot AND anyone AND slump AND youk AND field AND help	0.0
lived AND closer AND wish AND moms AND sure	0.0
cup AND starbucks AND coffee	0.0
schoolhave AND stalinwhile AND enemies AND yea AND fall AND cowboy AND quddafi AND verbal AND helpful AND politifactorgobamas AND hour AND ok AND process AND alinsky AND citizens AND turkey AND fees AND socialist AND yearsbut AND expansion AND links AND first AND promisesread AND daynnnnhe AND insult AND verifying AND criuticism AND 200 AND propagnadizebtwwho AND pages AND see AND thrashing AND claims AND idiotic AND except AND notion AND cause AND groups AND rejected AND gotten AND praises AND partisan AND show AND plants AND effort AND vomit AND mitch AND saul AND spent AND 2008 AND laugh AND energy AND work AND squawkni AND atmosphere AND laughable AND divisive AND somali AND truththey AND selling AND non AND partisandont AND redumblicans AND vitriolic AND pirates AND regulations AND based AND partisans AND yrsthis AND comical AND bill AND postxc2xa0obama AND fines AND demonization AND neck AND fix AND considered AND pass AND verify AND supports AND parrot AND laden AND claimsis AND bile AND hows AND mexican AND posted AND al AND sea AND warfare AND democracy AND cosigns AND listening AND facts AND sandbox AND squash AND gave AND el AND write AND countrymr AND rushbo AND whos AND starts AND create AND honestly AND watching AND wasteddont AND career AND avi AND jobs AND profile AND failed AND obamas AND efforts AND domestic AND stevenglens AND queda AND several AND green AND voters AND bin AND republicans AND willrefer	0.0
liberals	0.0
ka AND liverpool AND new AND hats AND wearing AND kkk AND fa AND cupnnare	0.0
might AND bible AND need AND determine AND tubby AND spend AND gay AND nos AND tell AND temperature AND diet AND butt AND suggest AND break AND looks AND ugly AND vagina AND tropical AND problems AND suffer AND pirate AND florida AND sara AND husband AND covered AND sucks AND wire AND thanks AND guarantee AND car AND touch AND going AND son AND poor AND funny AND teased AND ranting AND hate AND grow AND hugging AND tweenie AND health AND hole AND wait AND fast AND computer AND food AND oh AND sammy AND throw AND glory AND tree AND climate AND rather AND christian AND knock AND thermometer AND cj AND head AND sit AND worthless AND outside AND route AND fat AND sam AND us AND compare AND darling	0.0
